{
  "schema_version": 1,
  "request_id": "33333333333333333333333333333333",
  "owner_subject_id": "fixture-owner",
  "session_id": "fixture-session",
  "runtime_id": "fixture-runtime",
  "runtime_epoch": "11111111111111111111111111111111",
  "runtime_generation": 1,
  "command": "open_session",
  "payload": {
    "workspace_id": "workspace-fixture",
    "snapshot": {},
    "transcript_revision": 0,
    "config": {}
  }
}
